{
  "schema_version": "power-ringmin.fixed_order_result.v1",
  "artifact_type": "fixed_order_numerical_result",
  "problem": {
    "project": "power-ringmin",
    "radius_model": "quadratic",
    "dimension": 2,
    "constraints": {
      "central_external_tangency": true,
      "peripheral_pairwise_disjoint_interiors": true,
      "all_pairs_checked": true
    }
  },
  "instance": {
    "n": 3,
    "radius_sequence": {
      "kind": "explicit",
      "formula": "k^2",
      "index_base": 1,
      "indices": [
        1,
        2,
        3
      ],
      "radii": [
        "1",
        "4",
        "9"
      ]
    }
  },
  "fixed_order": {
    "order_type": "cyclic",
    "index_order": [
      1,
      2,
      3
    ],
    "radius_order": [
      "1",
      "4",
      "9"
    ],
    "orientation": "counterclockwise",
    "equivalence": "rotation_reflection",
    "angle_anchor": {
      "position_index": 0,
      "angle_decimal": "0.0"
    }
  },
  "result": {
    "result_kind": "full_fixed_order_radius",
    "objective_status": "bracketed_fixed_order_minimum",
    "feasible": true,
    "central_radius": {
      "decimal": "0.383387036139369666046287136725326497769868683075106548012937032203848453896270000028316442",
      "encoding": "decimal_string",
      "source_precision_digits": 90
    },
    "chain_radius": {
      "decimal": "0.383387036139369666046287136725326497769868683075106548012937032203848453896270000028316442",
      "encoding": "decimal_string",
      "source_precision_digits": 90
    },
    "positions_rad": [
      "0.0",
      "1.89576430937638296535337440839081602254858734184268428900162404618244843474117902735829805",
      "4.31538465542226069948095615106768798348417909315403884330373629437255757427842998878470739"
    ],
    "local_radius_bracket": {
      "eta_decimal": "1e-20",
      "lower_radius_feasible": false,
      "claimed_radius_feasible": true,
      "upper_radius_feasible": true,
      "method": "mpmath all-pairs STN feasibility with local eta bracket"
    },
    "binding_structure": {
      "essential_tight_pairs": [
        {
          "i": 0,
          "j": 1,
          "radius_i": "1",
          "radius_j": "4",
          "kind": "forward",
          "slack_decimal": "0"
        },
        {
          "i": 0,
          "j": 2,
          "radius_i": "1",
          "radius_j": "9",
          "kind": "wrap",
          "slack_decimal": "0"
        },
        {
          "i": 1,
          "j": 2,
          "radius_i": "4",
          "radius_j": "9",
          "kind": "forward",
          "slack_decimal": "0"
        }
      ],
      "recovered_tight_pairs": [
        {
          "i": 0,
          "j": 1,
          "radius_i": "1",
          "radius_j": "4",
          "kind": "forward",
          "slack_decimal": "0"
        },
        {
          "i": 0,
          "j": 2,
          "radius_i": "1",
          "radius_j": "9",
          "kind": "wrap",
          "slack_decimal": "0"
        },
        {
          "i": 1,
          "j": 2,
          "radius_i": "4",
          "radius_j": "9",
          "kind": "forward",
          "slack_decimal": "0"
        }
      ],
      "floating_radii": []
    },
    "diagnostics": {
      "stn_diagonal_margin_decimal": "-9.99999999999999999999999999999999999999999999182176323839952736967305116739751744864927456e-46"
    }
  },
  "precision": {
    "value_encoding": "decimal_string",
    "primary_backend": "mpmath",
    "working_precision_digits": 90,
    "rounding_policy": "Decimal strings emitted with mpmath nstr at 90 significant digits.",
    "tolerances": [
      {
        "name": "stn_diagonal_feasibility",
        "value_decimal": "1e-45",
        "tolerance_type": "absolute",
        "applies_to": "minimum closed-STN diagonal margin"
      },
      {
        "name": "local_radius_eta",
        "value_decimal": "1e-20",
        "tolerance_type": "absolute",
        "applies_to": "local fixed-order radius bracket"
      },
      {
        "name": "witness_angle",
        "value_decimal": "1e-8",
        "tolerance_type": "absolute",
        "applies_to": "witness angular pair slacks"
      },
      {
        "name": "witness_cartesian",
        "value_decimal": "1e-8",
        "tolerance_type": "absolute",
        "applies_to": "witness Cartesian pair distances"
      }
    ]
  },
  "provenance": {
    "created_at_utc": "2026-07-10T00:00:00Z",
    "repository": {
      "name": "power-ringmin",
      "git_commit": "2a4f8d01fee83f7cf2f00907922906be3c28e210",
      "git_dirty": false,
      "notes": "Schema example values were computed from the clean repository state before the schema design files were added."
    },
    "software": [
      {
        "name": "Python",
        "version": "3.14.3",
        "role": "runtime"
      },
      {
        "name": "mpmath",
        "version": "1.3.0",
        "role": "high-precision arithmetic"
      },
      {
        "name": "power-ringmin",
        "version": "0.1.0",
        "role": "fixed-order generator"
      }
    ],
    "source_files": [
      {
        "path": "src/power_ringmin/highprec.py",
        "role": "high-precision fixed-order STN computation",
        "upstream_ringmin_commit": "cc0327400819fe06b230d967cdcbafffe1648317"
      },
      {
        "path": "verify.py",
        "role": "standalone high-precision verifier",
        "upstream_ringmin_commit": "cc0327400819fe06b230d967cdcbafffe1648317"
      }
    ],
    "commands": [
      {
        "command": "python -c \"import sys; sys.path.insert(0, 'src'); import mpmath as mp; from power_ringmin.geometry import quadratic_radii; from power_ringmin.highprec import full_radius_mp, recover_positions_mp, feasibility_margin_mp; order=quadratic_radii(3); R=full_radius_mp(order, digits=90); pos=recover_positions_mp(order, R, digits=90); margin=feasibility_margin_mp(order, R, digits=90); print('order', order); print('R', mp.nstr(R, 90)); print('positions', [mp.nstr(p, 90) for p in pos]); print('margin', mp.nstr(margin, 90))\"",
        "cwd": "C:\\Users\\Falker\\Desktop\\Code\\circle\\ringmin-squared",
        "result": "pass",
        "output_summary": "Produced order (1, 4, 9), the recorded radius, witness positions, and the recorded STN diagonal margin."
      }
    ],
    "randomness": {
      "used": false,
      "seeds": []
    }
  },
  "evidence": {
    "classification": "numerical_observation",
    "claim": {
      "scope": "schema_fixture",
      "statement": "This artifact is a checked schema fixture for the fixed cyclic order (1, 4, 9); it is not a global optimum certificate."
    },
    "checks": [
      {
        "check_id": "EV-001",
        "classification": "verified_fact",
        "method": "mpmath high-precision full-radius bisection and position recovery",
        "command": "python -c \"... full_radius_mp(order, digits=90) ...\"",
        "result": "pass",
        "output_summary": "Generated the recorded radius, positions, and STN diagonal margin.",
        "limitations": "Uses the repository high-precision implementation rather than an external proof assistant."
      },
      {
        "check_id": "EV-002",
        "classification": "verified_fact",
        "method": "standalone verifier functions check all-pairs STN feasibility, local eta bracket, and witness positions in tests",
        "command": "python -m pytest tests/test_fixed_order_artifact_schema.py",
        "result": "pass",
        "output_summary": "Recorded as expected verification for this schema fixture.",
        "limitations": "The fixture demonstrates the schema contract only; it does not establish a general theorem."
      }
    ],
    "limitations": [
      "Finite fixed-order computation only.",
      "No global cyclic-order optimality claim.",
      "No theorem for all n."
    ]
  }
}
